{"schemaVersion":1,"id":"hierarchy-v1","description":"parent and child durable entries","epoch":"epoch-hierarchy-1","baseTime":"2026-01-01T00:02:00.000Z","revision":"rev-hierarchy-2","hostId":"host-hierarchy","sessionId":"session-hierarchy","projectId":"project-hierarchy","scripts":{"prompt":[{"atMs":5,"kind":"entry","text":"parent"},{"atMs":15,"kind":"entry","text":"child"}],"replay":"none"},"faults":[],"expectedHash":"8ac026ad4bf17f5bc295649ffe0d99c36b647f48a6ec6316ffa6bfcc5cd67f9c"}