{"schemaVersion":1,"id":"history-10k-v1","description":"algorithmic ten thousand message history","epoch":"epoch-history-1","baseTime":"2026-01-01T00:03:00.000Z","revision":"rev-history-10000","hostId":"host-history","sessionId":"session-history","projectId":"project-history","historyMessages":10000,"historyParts":30000,"scripts":{"prompt":[],"replay":"same-epoch"},"faults":[],"expectedHash":"839a64643922ecf2a3ee4e7ef8fe5a4d2c28591dbd0dfc038c5cc25b43f6bc7f"}