{"schemaVersion":1,"id":"stream-v1","description":"single prompt with deterministic deltas and settlement","epoch":"epoch-stream-1","baseTime":"2026-01-01T00:01:00.000Z","revision":"rev-stream-1","hostId":"host-stream","sessionId":"session-stream","projectId":"project-stream","scripts":{"prompt":[{"atMs":10,"kind":"event","text":"Hello"},{"atMs":20,"kind":"event","text":" world"},{"atMs":30,"kind":"entry","text":"Hello world"}],"replay":"none"},"faults":[],"expectedHash":"a637d5b75fd63d1d5067a70072a4e782b2744a2d55f7e027918c3b740f156b98"}