{"schemaVersion":1,"id":"basic-v1","description":"one idle session and deterministic command response","epoch":"epoch-basic-1","baseTime":"2026-01-01T00:00:00.000Z","revision":"rev-basic-1","hostId":"host-basic","sessionId":"session-basic","projectId":"project-basic","scripts":{"prompt":[],"replay":"none"},"faults":[],"expectedHash":"ce9abf80d0ec0311655c6f152707829d997a05c173d9779aba142132e992a81e"}