{"schemaVersion":1,"id":"faults-v1","description":"explicit malformed frames never mixed with normal state","epoch":"epoch-faults-1","baseTime":"2026-01-01T00:04:00.000Z","revision":"rev-faults-1","hostId":"host-faults","sessionId":"session-faults","projectId":"project-faults","scripts":{"prompt":[],"replay":"none"},"faults":[{"id":"bad-version","frame":{"v":"omp-app/999","type":"ping","nonce":"n","timestamp":"2026-01-01T00:04:00.000Z"},"expectedError":"MISSING_VERSION"},{"id":"unknown-type","frame":{"v":"omp-app/1","type":"wat"},"expectedError":"UNKNOWN_FRAME"},{"id":"bad-command","frame":{"v":"omp-app/1","type":"command","requestId":"r","commandId":"c","hostId":"host-faults","command":"wat","args":{}},"expectedError":"INVALID_FRAME"}],"expectedHash":"d9531d6afa57fa6ca9a713cdf0abc6ccf9764ee5a7ce899df3b4a1560037a737"}