{"schemaVersion":1,"id":"a11y-v1","description":"stable labels and accessibility fixture","epoch":"epoch-a11y-1","baseTime":"2026-01-01T00:07:00.000Z","revision":"rev-a11y-1","hostId":"host-a11y","sessionId":"session-a11y","projectId":"project-a11y","accessibility":true,"scripts":{"prompt":[],"replay":"none"},"faults":[],"expectedHash":"de73e2b38c381f33e2100fbe57b79f548bf7c7d73dfc337da18918f4f907a83b"}