{"schemaVersion":1,"id":"remote-v1","description":"remote host identity remains explicit","epoch":"epoch-remote-1","baseTime":"2026-01-01T00:06:00.000Z","revision":"rev-remote-3","hostId":"host-remote","sessionId":"session-remote","projectId":"project-remote","scripts":{"prompt":[],"replay":"none"},"faults":[],"expectedHash":"31f4f1684229f8b1fa5b09cc0404b46070491a7a151ab5b7ce2253cb09ecb6a9"}