{"schemaVersion":1,"id":"preview-v1","description":"prompt preview stream settles into an entry","epoch":"epoch-preview-1","baseTime":"2026-01-01T00:09:00.000Z","revision":"rev-preview-1","hostId":"host-preview","sessionId":"session-preview","projectId":"project-preview","scripts":{"prompt":[{"atMs":25,"kind":"event","text":"preview"},{"atMs":50,"kind":"entry","text":"preview complete"}],"replay":"none"},"faults":[],"expectedHash":"d61a05861c72775e2e30fcda5bac06548f8b411dc7f3cac1268f5009b2034a27"}