{"schemaVersion":1,"id":"reconnect-v1","description":"same epoch replay and changed epoch gap snapshot","epoch":"epoch-reconnect-1","baseTime":"2026-01-01T00:08:00.000Z","revision":"rev-reconnect-5","hostId":"host-reconnect","sessionId":"session-reconnect","projectId":"project-reconnect","scripts":{"prompt":[],"replay":"gap-snapshot"},"faults":[],"expectedHash":"ed59a0a702fec2f57248590eeab58f22b86b7110cba8c80f38a51ce3f42e6083"}