{"schemaVersion":1,"id":"multi-client-v1","description":"two clients with isolated command and prompt state","epoch":"epoch-multi-1","baseTime":"2026-01-01T00:05:00.000Z","revision":"rev-multi-1","hostId":"host-multi","sessionId":"session-multi","projectId":"project-multi","clients":2,"scripts":{"prompt":[{"atMs":10,"kind":"entry","text":"isolated"}],"replay":"none"},"faults":[],"expectedHash":"3ccdae99e50e0878e1dc4efa17a5956e3f2425ad7db99c755d339a065e5cffab"}